{
  "schema_version": "1.0.0",
  "audit_event_id": "1be8df60-0d95-4902-9147-5df042fe3d8e",
  "occurred_at": "2026-04-29T10:00:21Z",
  "tenant_id": "tenant_demo",
  "correlation_id": "cor_enquiry_email_001",
  "workflow_id": "uc1-enq-cor_enquiry_email_001",
  "actor": {
    "type": "agent",
    "id": "uc1.context_gatherer"
  },
  "category": "tool_gateway",
  "action": "customer_profile.lookup",
  "verdict": "allow",
  "details": {
    "tool_call_id": "5a54d79a-d311-4c80-b981-20b216552bf8",
    "mode": "read"
  }
}
